{
  "testRunId": "manual-sync-01",
  "evidenceType": "manual-sync-observation",
  "streamUrl": "http://localhost:8888/camera_sync_test/index.m3u8",
  "sourceId": "camera_sync_test",
  "displays": [
    {
      "displayId": "DISPLAY_01",
      "observedFrameNumber": 12345,
      "observedPts": "00:06:51.500",
      "playbackStatusPath": "displays/DISPLAY_01/playback-status.json",
      "screenshotPath": "displays/DISPLAY_01/screenshot.png"
    },
    {
      "displayId": "DISPLAY_02",
      "observedFrameNumber": 12348,
      "observedPts": "00:06:51.600",
      "playbackStatusPath": "displays/DISPLAY_02/playback-status.json",
      "screenshotPath": "displays/DISPLAY_02/screenshot.png"
    }
  ],
  "comparison": {
    "frameDifference": 3,
    "ptsDifferenceSeconds": 0.1,
    "toleranceFrames": 15,
    "toleranceSeconds": 0.5,
    "result": "PASS"
  },
  "notes": "Manual observation after refreshing both displays close together.",
  "capturedAt": "2026-06-18T00:00:00Z"
}
